{
  "$schema": "http://json-schema.org/draft-07/schema#",
  "$id": "https://renascor.github.io/schema/entry.schema.json",
  "title": "Renascor entry",
  "description": "A single catalogue entry describing a digital edition project of Renaissance-era written documents.",
  "type": "object",
  "required": [
    "title",
    "url",
    "languages",
    "encoding",
    "status",
    "provenance",
    "date_added"
  ],
  "additionalProperties": false,
  "properties": {
    "title": {
      "type": "string",
      "minLength": 1,
      "maxLength": 300,
      "description": "Name of the edition project or collection."
    },
    "url": {
      "type": "string",
      "format": "uri",
      "description": "URL where the edition can be found. Must be a valid, resolvable URL."
    },
    "doi": {
      "type": "string",
      "maxLength": 300,
      "pattern": "^10\\.[0-9]{4,9}/\\S+$",
      "description": "Verified DOI of the collection, edition or archived text dataset release, without the https://doi.org/ prefix. Do not use a grant DOI or a DOI for a related article or poster."
    },
    "data_url": {
      "type": "string",
      "format": "uri",
      "description": "URL where the edition's machine-readable files can be obtained: a repository, a download page or a dataset record (e.g. GitHub, Zenodo, Oxford Text Archive). Give it whenever TEI or other XML files are publicly available. Optional; requires data_format."
    },
    "data_format": {
      "type": "string",
      "enum": [
        "tei",
        "xml",
        "json",
        "html",
        "plain-text",
        "wikitext",
        "markdown",
        "other"
      ],
      "description": "Format of the files available at data_url, with the same vocabulary as encoding. Required when data_url is given."
    },
    "languages": {
      "type": "array",
      "items": {
        "type": "string",
        "minLength": 1,
        "not": {
          "enum": ["Ancient Greek", "Modern Greek", "Multilingual", "Romance", "Romance (other)"]
        }
      },
      "minItems": 1,
      "uniqueItems": true,
      "description": "Languages of the texts, as human-readable names (e.g. 'Latin', 'Old French', 'Middle English')."
    },
    "language_counts": {
      "type": "array",
      "description": "For multilingual entries harvested into the Renascor Corpus: texts and words per language in the corpus snapshot, largest first; a language with three texts or fewer names them. Generated by scripts/language_breakdown.py.",
      "items": {
        "type": "object",
        "required": ["language", "texts", "words"],
        "additionalProperties": false,
        "properties": {
          "language": {"type": "string"},
          "texts": {"type": "integer", "minimum": 1},
          "words": {"type": "integer", "minimum": 0},
          "works": {"type": "array", "items": {"type": "string"}}
        }
      }
    },
    "document_types": {
      "type": "array",
      "description": "Kinds of document the edition's texts are: manuscript (handwritten originals, archival documents, letters), print (printed books, pamphlets, broadsides) and inscription (texts on monuments, gravestones, buildings and objects). Optional.",
      "minItems": 1,
      "uniqueItems": true,
      "items": {"type": "string", "enum": ["manuscript", "print", "inscription"]}
    },
    "encoding": {
      "type": "string",
      "enum": [
        "tei",
        "xml",
        "json",
        "html",
        "plain-text",
        "wikitext",
        "markdown",
        "other"
      ],
      "description": "Primary publicly available text format, using the richest published text data rather than internal encoding or the catalogue harvest format (TEI > other XML > JSON > HTML > wiki markup > plain text > Markdown)."
    },
    "status": {
      "type": "string",
      "enum": [
        "active",
        "archived",
        "discontinued"
      ],
      "description": "active = online and maintained; archived = still online but no longer maintained; discontinued = no longer online (the URL may point to an archived copy)."
    },
    "provenance": {
      "type": "string",
      "enum": [
        "submitted",
        "discovered"
      ],
      "description": "How the entry was added. 'submitted' = contributed by a human via issue or pull request. 'discovered' = found by the automated weekly search."
    },
    "date_added": {
      "type": "string",
      "format": "date",
      "description": "Date the entry was added to the catalogue, in YYYY-MM-DD format."
    },
    "author": {
      "type": "string",
      "maxLength": 300,
      "description": "Author of the source document(s), if known and applicable. Optional."
    },
    "date": {
      "type": "string",
      "maxLength": 100,
      "description": "Date or period of the source document(s), e.g. '1492', 'c. 1470-1485', '16th century'. Optional."
    },
    "institution": {
      "type": "string",
      "maxLength": 300,
      "description": "Institution, project team, or individual responsible for the edition. Optional."
    },
    "words": {
      "type": "integer",
      "minimum": 0,
      "description": "Size of the resource text in words within 1450–1700, before content deduplication. Document source and coverage; harvested counts can cover only a subset. Omit if unknown."
    },
    "texts": {
      "type": "integer",
      "minimum": 0,
      "description": "Number of resource text instances within 1450–1700, before content deduplication. Not a unique-work count. Document source and coverage; omit if unknown."
    },
    "region": {
      "type": "string",
      "maxLength": 200,
      "description": "Geographic area covered by the corpus, e.g. 'Italy', 'Low Countries', 'Iberian Peninsula'. Optional."
    },
    "countries": {
      "type": "array",
      "items": {
        "type": "string",
        "pattern": "^[A-Z]{2}(-[A-Z]{3})?$"
      },
      "minItems": 1,
      "maxItems": 8,
      "uniqueItems": true,
      "description": "Present-day countries where the documents were written or printed, most important first: ISO 3166-1 alpha-2 codes, or ISO 3166-2 codes for the nations of Great Britain (GB-ENG, GB-SCT, GB-WLS, GB-NIR). Every code must be listed in schema/countries.json, which also groups the countries into the historical areas used by the public site."
    },
    "period": {
      "type": "string",
      "maxLength": 100,
      "description": "Period covered by the corpus, e.g. '1450-1550', '16th century', 'Renaissance'. Optional."
    },
    "years_active": {
      "type": "object",
      "description": "Years during which the project was active. Optional.",
      "required": [
        "start"
      ],
      "additionalProperties": false,
      "properties": {
        "start": {
          "type": "integer",
          "minimum": 1400,
          "maximum": 2100,
          "description": "Year the project started."
        },
        "end": {
          "description": "Year the project ended, or the string 'ongoing' if still active.",
          "oneOf": [
            {
              "type": "integer",
              "minimum": 1400,
              "maximum": 2100
            },
            {
              "type": "string",
              "const": "ongoing"
            }
          ]
        }
      }
    },
    "notes": {
      "type": "string",
      "maxLength": 2000,
      "description": "Additional information: scope, quality notes, access conditions, licence. Optional."
    },
    "last_modified": {
      "type": "string",
      "format": "date",
      "description": "Date of the last modification of the resource as reported by its host (GitHub repo last push, Zenodo record update). Optional; host-dependent."
    },
    "license": {
      "type": "string",
      "minLength": 1,
      "maxLength": 300,
      "description": "Licence of the edition text, preferably an SPDX identifier or expression (e.g. CC-BY-SA-4.0, CC0-1.0). Use Copyright, Custom terms, Mixed, Public domain or Not stated when appropriate. This is separate from the catalogue metadata licence."
    },
    "license_url": {
      "type": "string",
      "format": "uri",
      "description": "Publisher page, dataset record or licence file supporting the edition-text licence."
    },
    "license_note": {
      "type": "string",
      "maxLength": 3000,
      "description": "Scope of the licence or differences between texts, annotation, images and other layers."
    },
    "corpus_statistics": {
      "type": "object",
      "additionalProperties": false,
      "required": [
        "snapshot",
        "words",
        "texts"
      ],
      "properties": {
        "snapshot": {
          "type": "string"
        },
        "words": {
          "type": "integer",
          "minimum": 0
        },
        "texts": {
          "type": "integer",
          "minimum": 0
        }
      },
      "description": "Renascor Corpus frozen in-core counts after the corpus duplicate filter. Kept separate from the catalogue resource size."
    },
    "count_basis": {
      "type": "string",
      "enum": [
        "rq-retained-rows",
        "rq-retained-rows-and-staging",
        "sefaria-source-versions"
      ],
      "description": "Historical rq values count all retained in-core Renascor Corpus rows, including duplicates, with optional locked staging recovery. Sefaria counts individual Hebrew source versions of works composed within 1450–1700, excluding generated merged files and translations. See resource_statistics for the source audit."
    },
    "resource_statistics": {
      "type": "object",
      "additionalProperties": false,
      "required": ["url", "date", "note"],
      "properties": {
        "url": {"type": "string", "format": "uri"},
        "date": {"type": "string", "format": "date"},
        "note": {"type": "string", "maxLength": 2000}
      },
      "description": "Source, retrieval date and method for a separate resource census. Takes precedence over the Renascor Corpus harvested-subset size while preserving corpus_statistics."
    },
    "data_formats": {
      "type": "array",
      "items": {
        "type": "string",
        "enum": [
          "tei",
          "xml",
          "json",
          "html",
          "plain-text",
          "wikitext",
          "markdown",
          "other"
        ]
      },
      "minItems": 1,
      "uniqueItems": true,
      "description": "All available download formats. Include data_format, the primary format. Optional; requires data_url."
    },
    "api_url": {
      "type": "string",
      "format": "uri",
      "description": "Official documentation for programmatic access to the edition texts."
    }
  },
  "dependencies": {
    "data_url": [
      "data_format"
    ],
    "data_format": [
      "data_url"
    ],
    "data_formats": [
      "data_url",
      "data_format"
    ]
  }
}
