{
  "title": "EEBO Text Creation Partnership",
  "url": "https://www.textpartnership.net/tcp-texts/eebo-tcp-early-english-books-online/",
  "data_url": "https://github.com/textcreationpartnership",
  "data_format": "tei",
  "languages": [
    "Greek",
    "Dutch",
    "English",
    "French",
    "German",
    "Hebrew",
    "Irish",
    "Italian",
    "Latin",
    "Portuguese",
    "Scots",
    "Spanish",
    "Welsh"
  ],
  "document_types": [
    "print"
  ],
  "encoding": "tei",
  "status": "active",
  "provenance": "discovered",
  "date_added": "2026-10-07",
  "institution": "Text Creation Partnership (Universities of Oxford, Michigan, and others)",
  "period": "1455-1700",
  "region": "England, Scotland, Ireland",
  "words": 1348840666,
  "years_active": {
    "start": 2002,
    "end": "ongoing"
  },
  "notes": "Keyed and corrected TEI XML transcriptions of Early English Books Online (EEBO) texts. Produces scholarly digital editions of early printed books. EEBO-TCP Phase I and II texts have been free of restrictions since 1 August 2020 (CC0). Corpus statistics (text, word and language counts, period) derived from the Renascor Corpus snapshot v2026.10 (texts harvested from this edition, duplicates included; they may cover only part of it).",
  "texts": 50486,
  "corpus_statistics": {
    "snapshot": "v2026.10",
    "words": 1342329634,
    "texts": 50237
  },
  "count_basis": "rq-retained-rows",
  "license": "CC0-1.0",
  "license_url": "https://www.textpartnership.net/pages/faq.html",
  "license_note": "TCP transcriptions are unrestricted, with CC0 declarations in the TEI files. The underlying page images have separate rights.",
  "language_counts": [
    {
      "language": "English",
      "texts": 49482,
      "words": 1316770075
    },
    {
      "language": "Latin",
      "texts": 589,
      "words": 16706385
    },
    {
      "language": "Welsh",
      "texts": 141,
      "words": 9324752
    },
    {
      "language": "French",
      "texts": 146,
      "words": 2201550
    },
    {
      "language": "Scots",
      "texts": 45,
      "words": 1769985
    },
    {
      "language": "Irish",
      "texts": 1,
      "words": 841721,
      "works": [
        "EEBO-TCP A28067 (1690)"
      ]
    },
    {
      "language": "Romance (other)",
      "texts": 10,
      "words": 451679
    },
    {
      "language": "Italian",
      "texts": 28,
      "words": 415049
    },
    {
      "language": "Multilingual",
      "texts": 4,
      "words": 230076
    },
    {
      "language": "Spanish",
      "texts": 11,
      "words": 70581
    },
    {
      "language": "Dutch",
      "texts": 20,
      "words": 27583
    },
    {
      "language": "German",
      "texts": 4,
      "words": 21755
    },
    {
      "language": "Portuguese",
      "texts": 2,
      "words": 7592,
      "works": [
        "EEBO-TCP A39859 (1663)"
      ]
    },
    {
      "language": "Greek",
      "texts": 2,
      "words": 1765,
      "works": [
        "EEBO-TCP A39349 (1668)",
        "EEBO-TCP A46029 (1696)"
      ]
    },
    {
      "language": "Hebrew",
      "texts": 1,
      "words": 118,
      "works": [
        "EEBO-TCP A74086 (1660)"
      ]
    }
  ]
}
