{
  "title": "Litteraturbanken Swedish",
  "url": "https://spraakbanken.gu.se/en/resources/lb-open",
  "data_url": "https://litteraturbanken.se/bibliotek?nedladdning=true",
  "data_format": "tei",
  "languages": [
    "Swedish"
  ],
  "encoding": "tei",
  "status": "active",
  "provenance": "submitted",
  "date_added": "2026-10-07",
  "words": 114226,
  "texts": 7,
  "period": "1611-1649",
  "notes": "Corpus statistics (text, word and language counts, period) derived from the Renascor Corpus snapshot v2026.06 (texts harvested from this edition, duplicates included; they may cover only part of it). https://spraakbanken.gu.se/en/resources/lb-open; rebuild/litteraturbanken_swedish_source_selection_2026-06-24.tsv; data/raw/Litteraturbanken_Swedish/Litteraturbanken_Swedish.jsonl; rebuild/rawtree_ful",
  "corpus_statistics": {
    "snapshot": "v2026.06",
    "words": 114226,
    "texts": 7
  },
  "count_basis": "rq-retained-rows",
  "license": "Mixed",
  "license_url": "https://litteraturbanken.se/api/list_all/etext",
  "license_note": "Includes CC0-1.0. Licences or rights differ by text, corpus or editorial layer; consult the source terms for the selected material."
}
