{
  "title": "Mitteldeutsche Selbstzeugnisse der Zeit des Dreißigjährigen Krieges (MDSZ)",
  "url": "https://web.archive.org/web/20221126133641/http://mdsz.thulb.uni-jena.de/sz/index.php",
  "languages": [
    "German"
  ],
  "document_types": [
    "manuscript"
  ],
  "encoding": "html",
  "status": "discontinued",
  "institution": "Thüringer Universitäts- und Landesbibliothek Jena, with Hans Medick and Norbert Winnige (Göttingen)",
  "date": "17th century",
  "period": "17th century (Thirty Years' War)",
  "region": "Thuringia, Saxony-Anhalt",
  "countries": [
    "DE"
  ],
  "texts": 6,
  "license": "Not stated",
  "notes": "Electronic edition of four autobiographical texts of the Thirty Years' War, with transcriptions of the originals, digital facsimiles, commentary and indexes: the chronicle of Volkmar Happe (1587-1647/59), the notes of Michael Heubel (1605-1684), Hans Krafft (1589-1665) and Caspar Heinrich Marx (1600-1635). The original address (mdsz.thulb.uni-jena.de) now serves an unrelated Shlink page; the Internet Archive holds copies of the site as it was in 2022. The portal 'Thirty Years War Online' (hosted by the ThULB since 2024) still links to the old address. The counts cover 735 of about 2,600 manuscript pages recovered from Internet Archive copies, so they are a lower bound. Corpus statistics (text and word counts) derived from the Renascor Corpus snapshot v2026.10 (texts harvested from this resource in October 2026, duplicates included; they may cover only part of it).",
  "provenance": "discovered",
  "date_added": "2026-10-12",
  "words": 76604,
  "corpus_statistics": {
    "snapshot": "v2026.10",
    "words": 76604,
    "texts": 6
  },
  "count_basis": "rq-retained-rows",
  "license_note": "No licence on the archived site (2022 Internet Archive copy of the home page and Impressum, which names the ThULB as publisher and the editors, and carries only a liability disclaimer); the original site is offline and the ThULB's general terms have no collection-specific licence (checked 2026-10-13). Images are credited by permission of the Germanisches Nationalmuseum and partner archives."
}
