{
  "title": "Storia d'Italia (Francesco Guicciardini): analytical digital edition of the opening passage",
  "url": "https://guicciardini-storia-italia.huma-num.fr/",
  "data_url": "https://guicciardini-storia-italia.huma-num.fr/files/SI_Ms_30_3juillet2019H.xml",
  "data_format": "tei",
  "languages": [
    "Italian"
  ],
  "document_types": [
    "manuscript"
  ],
  "encoding": "tei",
  "status": "archived",
  "author": "Francesco Guicciardini",
  "date": "1537-1540",
  "institution": "Paola Moreno (Université de Liège) with Élise Leclerc (Université Grenoble Alpes) and Samantha Saïdi (ENS de Lyon)",
  "words": 7867,
  "texts": 14,
  "region": "Italy (Florence)",
  "countries": [
    "IT"
  ],
  "period": "1537-1540",
  "last_modified": "2021-02-16",
  "license": "CC-BY-NC-SA-4.0",
  "license_url": "https://creativecommons.org/licenses/by-nc-sa/4.0/",
  "notes": "Semi-diplomatic transcriptions, beside facsimiles, of the successive drafts of the opening passage (exordium) of Guicciardini's History of Italy in eight manuscripts (family archive and Biblioteca Medicea Laurenziana, Florence). Only the opening is edited so far; the project hopes to extend it. The site was last changed in 2021 (server dates 2019-2021) and no extension has appeared since. The 14 transcribed sections carry no dates, so their place within 1450-1700 rests on the dating of the drafts to 1537-1540. Corpus statistics (text and word counts) derived from the Renascor Corpus snapshot v2026.10 (texts harvested from this resource in October 2026, duplicates included; they may cover only part of it).",
  "provenance": "discovered",
  "date_added": "2026-10-12",
  "corpus_statistics": {
    "snapshot": "v2026.10",
    "words": 7867,
    "texts": 14
  },
  "count_basis": "rq-retained-rows"
}
