{
  "title": "Calvin Institutio",
  "url": "https://calvin.reformation.nl/872-Institutes+of+the+Christian+Religion.",
  "languages": [
    "French",
    "Latin"
  ],
  "encoding": "other",
  "status": "active",
  "provenance": "submitted",
  "date_added": "2026-10-07",
  "words": 1053747,
  "texts": 162,
  "period": "1559-1560",
  "notes": "Corpus statistics (text, word and language counts, period) derived from the RQ Open Corpus snapshot v2026.06 (in-core, deduplicated texts). https://calvin.reformation.nl/872-Institutes+of+the+Christian+Religion.; rebuild/calvin_institutio_source_selection_2026-06-24.tsv; data/raw/Calvin_Institutio/Calvin_Institutio.jsonl; rebuild/rawtree_"
}
