{
  "title": "Statutes of the Realm",
  "url": "https://www.british-history.ac.uk/series/statutes-realm",
  "provenance": "submitted",
  "date_added": "2026-10-07",
  "institution": "Institute of Historical Research (British History Online)",
  "languages": [
    "English"
  ],
  "document_types": [
    "print"
  ],
  "encoding": "html",
  "words": 1112931,
  "texts": 291,
  "period": "1625-1697",
  "status": "active",
  "notes": "Corpus statistics (text, word and language counts, period) derived from the Renascor Corpus snapshot v2026.10 (texts harvested from this edition, duplicates included; they may cover only part of it).",
  "corpus_statistics": {
    "snapshot": "v2026.10",
    "words": 1112931,
    "texts": 291
  },
  "count_basis": "rq-retained-rows",
  "license": "Not stated",
  "license_url": "https://www.british-history.ac.uk/statutes-realm/vol5",
  "license_note": "No reuse licence established from the available publisher-source evidence."
}
