{
  "title": "Mazarinades",
  "url": "https://antonomaz.huma-num.fr/",
  "data_url": "https://github.com/Antonomaz/Corpus",
  "data_format": "tei",
  "provenance": "submitted",
  "date_added": "2026-10-07",
  "institution": "Projet ANTONOMAZ, Sorbonne Université (Karine Abiven)",
  "languages": [
    "French"
  ],
  "encoding": "tei",
  "words": 10122051,
  "texts": 3064,
  "period": "1648-1653",
  "status": "active",
  "notes": "Mazarinades (pamphlets of the Fronde, 1648-1653) published by the ANTONOMAZ project at Sorbonne Université. The counts come from the Zenodo release of December 2022 (3,064 files); the project site and its GitHub repository now hold more (3,132 texts). Corpus statistics (text, word and language counts, period) derived from the Renascor Corpus snapshot v2026.06 (texts harvested from this edition, duplicates included; they may cover only part of it).",
  "last_modified": "2026-05-22",
  "corpus_statistics": {
    "snapshot": "v2026.06",
    "words": 10122051,
    "texts": 3064
  },
  "count_basis": "rq-retained-rows",
  "license": "CC-BY-4.0",
  "license_url": "https://zenodo.org/records/7443183",
  "doi": "10.5281/zenodo.7443183"
}
