{
  "title": "VAKK Estonian",
  "url": "https://vakk.ut.ee",
  "languages": [
    "Estonian"
  ],
  "encoding": "html",
  "status": "active",
  "provenance": "submitted",
  "date_added": "2026-10-07",
  "words": 646479,
  "texts": 87,
  "period": "1490-1700",
  "notes": "Corpus statistics (text, word and language counts, period) derived from the Renascor Corpus snapshot v2026.06 (texts harvested from this edition, duplicates included; they may cover only part of it). https://vakk.ut.ee/; rebuild/vakk_estonian_source_selection_2026-06-24.tsv; data/raw/VAKK_Estonian/VAKK_Estonian.jsonl; rebuild/rawtree_full_lock_2026-07-16.tsv",
  "corpus_statistics": {
    "snapshot": "v2026.06",
    "words": 646452,
    "texts": 83
  },
  "count_basis": "rq-retained-rows-and-staging",
  "license": "Mixed",
  "license_url": "https://metashare.ut.ee/static/licences/CC-BYNCv3.0.htm",
  "license_note": "Includes CC-BY-NC-3.0. Licences or rights differ by text, corpus or editorial layer; consult the source terms for the selected material."
}
