{
  "title": "DissEd PhDeditions",
  "url": "https://theses.fr",
  "languages": [
    "French",
    "Italian",
    "Latin",
    "Occitan"
  ],
  "encoding": "other",
  "status": "active",
  "provenance": "submitted",
  "date_added": "2026-10-07",
  "words": 254491,
  "texts": 9,
  "period": "1480-1698",
  "notes": "Corpus statistics (text, word and language counts, period) derived from the Renascor Corpus snapshot v2026.06 (texts harvested from this edition, duplicates included; they may cover only part of it). https://theses.fr + https://diva-portal.org; rebuild/dissed_phdeditions_source_selection_2026-06-24.tsv; data/raw/DissEd_PhDeditions/DissEd_PhDeditions.jsonl; rebuild/rawtree_full_lock_2026-07-16.tsv",
  "corpus_statistics": {
    "snapshot": "v2026.06",
    "words": 254491,
    "texts": 9
  },
  "count_basis": "rq-retained-rows",
  "license": "Not stated",
  "license_url": "https://about.hal.science/hal-authorisation-v1/",
  "license_note": "No reuse licence established from the available publisher-source evidence."
}
