{
  "title": "Lo statuto di Paganico: statuti della comunità (secolo XV)",
  "url": "https://web.archive.org/web/20050217022521/http://www.gol.grosseto.it/puam/arcstato/paganico/pagcop.htm",
  "languages": [
    "Italian"
  ],
  "document_types": [
    "manuscript"
  ],
  "encoding": "html",
  "status": "discontinued",
  "date": "late 15th century (approved 1487-1490)",
  "institution": "Archivio di Stato di Grosseto and Pro Loco di Paganico (edited by Silvia Cappelli and Franca Doccini; introduction by Mario Ascheri)",
  "region": "Tuscany (Maremma)",
  "countries": [
    "IT"
  ],
  "period": "1487-1490",
  "texts": 1,
  "notes": "Edition of a single statute book, the only known copy, with an introduction, historical and codicological chapters, an index of rubrics and the full text of the rubrics (page 'Edizione'). The original site (www.gol.grosseto.it) no longer answers; the link points to the Internet Archive capture of 17 February 2005, which loads fully. Statutes were approved by Siena in 1487, 1489 and 1490. The counts cover the full statute text of the archived copy, not the introduction or the historical and codicological chapters. Corpus statistics (text and word counts) derived from the Renascor Corpus snapshot v2026.10 (texts harvested from this resource in October 2026, duplicates included; they may cover only part of it).",
  "provenance": "discovered",
  "date_added": "2026-10-12",
  "words": 23143,
  "corpus_statistics": {
    "snapshot": "v2026.10",
    "words": 23143,
    "texts": 1
  },
  "count_basis": "rq-retained-rows",
  "license": "Not stated",
  "license_note": "No licence or rights statement on the Internet Archive capture (17 Feb 2005) of the edition pages (cover, introduction, edition, indexes) or of the Archivio di Stato di Grosseto parent page; the pages name only the Ministero per i beni ambientali e culturali, the Archivio di Stato di Grosseto and the Pro Loco di Paganico (checked 2026-10-13). The original site is offline."
}
