{
  "title": "Magyar Elektronikus Könyvtár (MEK)",
  "url": "https://mek.oszk.hu/",
  "provenance": "submitted",
  "date_added": "2026-10-07",
  "languages": [
    "Hungarian"
  ],
  "document_types": [
    "print"
  ],
  "encoding": "html",
  "words": 418083,
  "texts": 8,
  "period": "1554-1693",
  "status": "active",
  "notes": "Hungarian Electronic Library (MEK), the digital library of the National Széchényi Library. Most of the texts come from MEK; three poems (Gyöngyösi's Murányi Vénus and Phoenix, Esterházy's Egy csudálatos ének) were taken from the Syrena site of the Department of Old Hungarian Literature, ELTE (magyar-irodalom.elte.hu/syrena). Corpus statistics (text, word and language counts, period) derived from the Renascor Corpus snapshot v2026.10 (texts harvested from this edition, duplicates included; they may cover only part of it).",
  "corpus_statistics": {
    "snapshot": "v2026.10",
    "words": 418083,
    "texts": 8
  },
  "count_basis": "rq-retained-rows",
  "license": "Mixed",
  "license_url": "https://mek.oszk.hu/html/allando/copyright.htm",
  "license_note": "Licences or rights differ by text, corpus or editorial layer; consult the source terms for the selected material.",
  "institution": "National Széchényi Library (OSZK), Budapest"
}
