{
  "title": "GitLab des humanités numériques (Huma-Num)",
  "url": "https://gitlab.huma-num.fr/",
  "data_url": "https://gitlab.huma-num.fr/crh/factums-metiers/factums-ancien-regime",
  "data_format": "tei",
  "languages": [
    "French",
    "Latin",
    "Spanish"
  ],
  "encoding": "tei",
  "status": "active",
  "provenance": "submitted",
  "date_added": "2026-10-07",
  "words": 1816659,
  "texts": 77,
  "institution": "IR Huma-Num",
  "period": "1474-1700",
  "notes": "Corpus statistics (text, word and language counts, period) derived from the Renascor Corpus snapshot v2026.06 (texts harvested from this edition, duplicates included; they may cover only part of it). rebuild/remaining_missing_collections_2026-06-13.txt; rebuild/remaining_missing_source_selection_2026-06-13.tsv; rebuild/remaining_missing_source_blocked_audit_2026-06-13.csv; rebuild/remaining_missin",
  "corpus_statistics": {
    "snapshot": "v2026.06",
    "words": 1816659,
    "texts": 77
  },
  "count_basis": "rq-retained-rows",
  "license": "Mixed",
  "license_url": "https://creativecommons.org/licenses/by-nc-sa/4.0/deed.fr",
  "license_note": "Includes CC-BY-NC-SA-4.0. Licences or rights differ by text, corpus or editorial layer; consult the source terms for the selected material."
}
