{
  "title": "Kirishitan Japanese",
  "url": "https://www2.ninjal.ac.jp/textdb_dataset/en",
  "data_url": "https://www2.ninjal.ac.jp/textdb_dataset/en/",
  "data_format": "plain-text",
  "languages": [
    "Japanese"
  ],
  "document_types": [
    "print"
  ],
  "encoding": "plain-text",
  "status": "active",
  "provenance": "submitted",
  "date_added": "2026-10-07",
  "words": 154229,
  "texts": 4,
  "period": "1592-1603",
  "notes": "Corpus statistics (text, word and language counts, period) derived from the Renascor Corpus snapshot v2026.06 (texts harvested from this edition, duplicates included; they may cover only part of it). https://www2.ninjal.ac.jp/textdb_dataset/en/.",
  "corpus_statistics": {
    "snapshot": "v2026.06",
    "words": 154229,
    "texts": 4
  },
  "count_basis": "rq-retained-rows",
  "license": "Copyright",
  "license_url": "https://clrd.ninjal.ac.jp/chj/subscription.html",
  "license_note": "Copyright restrictions apply; no standard open reuse licence established."
}
